type	tweetsneg	رئيسين يومين قالو الربيع العربي نحنا الكتاحه الأفريقية
neg	حالة الطرق حالة الطرق الصباح السبت حركة مرورية نشطة كافة المفترقات
neg	اوف ليش العنصرية ذي كلهم عيال شهور
neg	الدنيا غرقت امطار برد وانا نايمه
neg	ذكرتيني زرفت سماعة اخواني الصغار وحطيت مناكير يحسبها لي وقعد يدور حقته مايدري
neg	احتاج الوليد طلال يلاعبني زي بنته اغديه يعطيني فلوس وش تعلمت الدنياء
neg	ماجيتك ياتويتر وانا حالتي عال ماجيتك ألاوانا الفين عله
neg	أغار أحب غيرتي تصل لبكاء أحب الإنتظار أفقد أعصابي بسرعه وأكره فكرة إنشغال أحب
neg	بحترم جدآ الناس غلطت تعتذر ومتكبرش تكبر تحيه لحضرتك
neg	اسامة منير بيقربلك يا بلحة
neg	تخافي نفسك رجل يعشق أمه فمن يقدر إمرأه خلق أحشائها يؤذي إمرأه يحبها
neg	انتظرك ولازلت متمسك فيك وغيري لأسف فيك يقهرني
neg	نعيد تاريخهم مره شفت وثائقي لاحظت العلماء عاشو اواخر التشد المسيحي اشلون ابحاثهم واخترا
neg	صاحية النوم والشياطين راكبيتني
neg	ردوا يمه يبه الأصوات أساميهم يتيم ويتيمة كليب ليتامى
neg	ومادراك مابي
neg	منبهره بالشخص حبيته مره اشوفها احس اني مره اشوفها فعلا مبهره مذهله تملائك بالاسئله
neg	محد يحب ادهم نابلسي كثري
neg	السهل تضع يدك فمك كي لآ تكلم آلصعب تضع يدك قلبك
neg	فعلا ناكرات معروف تشتغل ساعه بس وتشرد
neg	الحياة الدنيا حياة تجمع المتناقضات السعادة والشقاء والحزن والفرح والصحة والمرض والنجاح والف
neg	مي تو اشوفه وانا داخلي مقهوره
neg	هام انا زي تينا بالظبط
neg	أحبك بكل أوتيت مرض صوت الحق لدعم كروب الزهور لدعم النرجس لدعم اميره الموسم عراق الخير
neg	نامجون داعس علينا ماكسرنا رقمه
neg	ليبيا معارك دائره الخائن حفتر والمجلس الوطني لوفاق السودان ثوره وانقلابات وانشقاقات الجزائر ثوره وعي عشا
neg	السلام عليكم ورحمة اله وبركاته مسابقه ابوغلا اكتب شي تؤجر الجوائز
neg	يارب أمطر قلوبنا رضا وفرحا ينسيها ماأحزنها ساعه استجابه
neg	اشراقة تغيب الشمس وتشرق شمس العالمي وتنور ليل عشاقه لبى النصر لبى عشاقة الاتحاد النصر
neg	اهم شي شو سوت بالذهب القصيدة كلها
neg	تابعهم مره حلوين
neg	استنى ماتقفلش الحفرة ادفنوها جنبهم التويت كاتباها دي
neg	معقولة الكلام الكبير يطلع ناصر القصبي مايعرف يجمع كلمتين مقابلة تلفزيونية وتخلص المقابل
neg	نفسي الاقي تويتر بتاعها تعبت كتير بدور مكن شير عسا يجمع القلوب وتحد
neg	شاء اله الدعم مستمر لكل الناس لي شارك معان
neg	عجيب العالم كلها تقدم الشكوى
neg	ايه يالباث واله اني حزين وخاطري مكسور
neg	اخيرا حس
neg	السبت الساعة صباحا صاحي هالوقت باله عليكم وش نقدر نسوي
neg	احب العلاقات الرسميه لأني أعرف أرسم
neg	حسبنا اله عليهم واله يسلط عليهم واله يفضحهم الملاء تسبو افساد الكرة لدينا اله يشغلهم انفسهم ويؤذ
neg	قوانين الغاز
neg	الخير
neg	غريب الدار
neg	النصر الاتحاد توقع نتيجة مباراه النصر الاتحاد الجائزه لصاحب التوقع الصحيح شروط المسابقه متابعه
neg	ٲنا ٲغيب ثيرا أسأل اشتاق اخبر بذلك شخصيتي يفهم ولن اضلعي
neg	يقول المثل الموزنبيقي تزوج المرأة تملك قدما أكبر قدمك
neg	احنا متفقين يا أهلي مفيش حاجة بتفرحنا البلد دي غيرك واحنا الحاجة لفرحة واله معاك المرة الحلوة
neg	سر المشاهير بوزن مثالي معنا رشاقتي البدايه الصحيه لجسم سليم وقوام رشيق الدايت حمية كلين
neg	موجب زاير النعيريه ويدور سالب جاد جاد كبير اهم شي جاد تعال الخاص اسرع شي سالب
neg	الهم شت شملهم
neg	واله وحدي ماشفت شي طول اليل العب بعدين نمت وتو قايمه اذاكر عندي خبر بالدنيا
neg	قآل لهآ وآثق بأنك ستنفذين مآ أطلبه منك دوما بلآ نقآش أنآ سي السيد ويحق لي رفعت النآعمة
neg	مافي فض اعتصام توجيه تجمع المهنين يا سودان مافي فض اعتصام توجيه تجمع المهنين يا سودان مافي فض اعتصا
neg	حسبي اله ونعم الوكيل ظلم والظلم ظلمات القيامه مسكي
neg	قوميز لاعب محترم جالس يلاحق حسين عبدالغني واله عقول الطواقي يبغالها فرمتة
neg	الوضع
neg	رجل صاحب نجاحات حاول رجل صاحب قيم
neg	ترا اكرها بس صدق يضحك
neg	اله جدار القلب تشبيه جميل ولاكن الاغشيه يصيبها القرحة فدعي السان الصامت يحكي عما
neg	تلاتين بترقص اليلة رقصتنا بكي دي حلاوة شديدة باخ
neg	نص مشاكلي بسب نبرة صوتي انا اناقش وهم يحسبوني اعلن الحرب مين مثلي
neg	تخيلك فارسها وتخيلها العوبه تضحك تبكي أجلك لاتعرف معنى الحب تستحق البقاء باطن الأرض
neg	واله الهلال قاهرني بس يلا مو مشكله نحط الحره الهدايا
neg	التكست مورنينج الحقيقي الغاء الامتحانات
neg	البعد اله
neg	تاخر الأحلام يجعلنا نكرها يخبرني الصباح
neg	بتقلديني لي
neg	الهلال فارق بنقاط وانا اشوف ملخصات بس الاهلي ماشفتها كاملة طبعا مباراة الن
neg	ليش ماعزمتوني
neg	احتسي قهوتي السوداء قلبي
neg	إحذر يمدحك تذكر دائما الرجل يداعب رأس الحمار ليركبه هكذا بعضهم يتسل
neg	افا هذي اخرتها نرد نشيد الاتحاد طول عمرنا نهايط ونقول الهلال مايهمه وفوق الجميع والحين ندور الفزعة فريق
neg	علمي بهذه القسوة رد لي الصفعة بقوة اضعاف اهلا شهد الصغيرة اهلا بك ابنتي العالم شديد القسوة
neg	اله لاياخذك ماتختار تصور الشاشه وصوتي تعبان
neg	مو عندي
neg	معقولة الكلام الكبير يطلع ناصر القصبي مايعرف يجمع كلمتين مقابلة تلفزيونية وتخلص المقابل
neg	الدعوه مخامط شنو اطلعي لي المحول
neg	ارجوكم اتوجهو لقياده تمثيليه بتاعت ضرب رصاص الهوا وبيقولو ديل قناصين عشان الناس تخاف وبيشيلو المتاريس
neg	يا اخوانا اله لسة مطالبنا أتحق مطلب عليكم اله الناس تخاذل
neg	الاهلي الهلال اكتب توقعك لنتيجة الهلال والاهلي التاق تحدي اسرع روقان وادخل سحب قيمة ايفون
neg	سنين وسنين وانا صابر وراح اصبر كمان وكمان
neg	وقتها توني متخرج الثانوي
neg	تعالي نبكي سوا
neg	شكلها تاريخية لنصر
neg	خدا صبرتون بده
neg	معطيني حظر منهو
neg	طيب تبكي عارف الصورة دي حارقاك شديد حاول تحافظ رجولتك الإهتزاز مرة تشوف مرأة حر
neg	اربطيها لحتى اوصل بيتكم وانا بتفاهم
neg	اله يرزقنا صوت المطر
neg	قطع قلبي
neg	خلاص بقا بتحسوني بالذنب اكتر انا
neg	إلا باله قهر ربي يصبرهم شاء اله موعرها
neg	سامعه صياح كوك ستان
neg	الحين صدق اهلي يقولون لي بنت تمناك وإلا تسليك
neg	الورد
neg	تلاتين بترقص اليلة رقصتنا بكي دي حلاوة شديدة باخ
neg	أذكرني انجرحت وأهملوك
neg	الصلاة والسلام ايه واله نقرأ وفاته نبكي وكأنها المرة الأولى فعلا تهون موته
neg	عنصريه المرأة معك كلامها رجعي
neg	هاذا رحل وهاذا زعل وهاذا غيرته الأيام اخبرو الجميع بأن الاصيل يبق
neg	شكلها المشكلة اني كنت ورطان ومو فاهم المسألة وقاعد احوس
neg	ناوي أشتري
neg	بنشكر اله انو القلب عضلة مو عظم بضل التعضيل ارحم الكسر
neg	بكم عاصمة التوائم العالم لافتة ترحب بزوار ولاية أويو بنيجيريا يعتقد السكان حساء أوراق البامية
neg	شكلها جوازه بايظه البدايه يلا خربوها وريحوا ملايكتهم
neg	واحنا صغار نعرف الشعب السوداني أطيب الشعوب العربية وإن السعوديه حامية حمي الاسلام بس أكتشفت السعوديه
neg	لأقعدن الطريق وأشتكي
neg	المكبره تخوفني جانت بلنهار قله اعزاز واكثرهم غرب هسه اطبه بليل بيه افرش وانام بيه امي اهناك خاف
neg	تلاتين بترقص اليلة رقصتنا بكي دي حلاوة شديدة باخ
neg	طبعا يخفى عليكم روبرت موردوخ إمبراطور الإعلام الصهيوني سكاي نيوز فرع عربي وفوكس نيوز ومجلة ني
neg	انتم قربتم تحقيق الدوري وحنا الهبوط
neg	مشكلة اعز اخوياك يتزوج تحول لانسان فاضي
neg	بليز عطوني رياكشن الولد يصيح ويقول عادي عادي
neg	تجار الكويت بدون تحية رسالة امرأة ورثت حر بقيمة وأراضي جدها وتحدث الزهد
neg	جاهزين مولعين شو يصبرنا بس
neg	نترجمها لك ياأصنج بالتركي والفارسي بحكم دولتك مغتصبه الأتراك والفرس وانتم متعودين عادي
neg	شنو مالت
neg	بخصوص اليديبي تغيرينه
neg	ليست الغربة مغآدرة الوطن مغآدرة أوطآن صغيرة حيآتنآ قلوب نحب
neg	لمجاراه الزعل والرضى تاهت مشاعرنا جيت كلك رضى رحت كلك زعل ياهيه تكفى دخيلك بس عبرنا اعطيك شحم الوعل
neg	اكتشفت حبيبتك بتدخن تسيبها تكمل معاها
neg	شعور جميل بس يشملني
neg	الهم اشفي فرح البلوشي وطهر جسدها واسكب انهارا الراحه
neg	أصبحت والشوق يحدوني إليك ودمعي شاهد وفؤادي فيك مشتغل يا طيبة الحب ضميني إليك عس
neg	زال طموحي وما زال
neg	ملاحظ كتير علشان تفكيرك هيك انت قدنا بس الاحوال تغيرت يبو حبيبة
neg	علقوني المراسيل وابيات القصيد واستباحو سكة البعد قدهم عايفين
neg	انا بكره الجامعة
neg	جلست أشتغل لين الفجر النهاية نقع الاب وراح الشغل
neg	تستاهل خيتي ام روان اله يحفظها ويحفظج زينب ولو محد متابعني بيكم حقكم عرفتوني
neg	بموت ماتوقعت يرد
neg	الصيف العام
neg	اجد فرصه لتعبير مدى حبي لك فذهبت بعيدا وذهب قلبي معك
neg	أبي الموت ابقاك لي فالعيش بعدك يا ضوء الحياة سدئ الموت ابقاك لي وطنا فاليوم
neg	اسعد القلب بابتسامة يحب وم اتعسه بعكس ذالك
neg	حينما تجلى النفس إشراقات الروح تجلى حقائق الأشياء والأحوال فتصبح الحياة حبا والعطاء نورا وال
neg	اجمل رقص خليجى وتقوم بالتعربى عير متحره سحاقيات تفريش مكوة إبريل صباحا
neg	واله اسمه مو زوران يصلح ثوران خلوني اكمل هدايا بس
neg	طاعة سيدي
neg	اعتدت والتعود اكبر الحب احيانا
neg	لقد كنت حذر الجميع ماعداك
neg	تفكيري وبالي
neg	يا رب تثقلنا انت وحدك عالم بيها
neg	موندم جمهوري اسلامي تنها حوصله اش سر نميره توي برجام
neg	الكل مرة قلتيلي التربية بس قلتلك انا ربيتها قاعدة وب
neg	بنشكر اله انو القلب عضلة مو عظم بضل التعضيل ارحم الكسر
neg	مجموعة كلين اخسر كيلو الاخصائيه سها السعدي تكميم حرمان
neg	كلام اهلها انهم دخلوها مستشفى الامل لمدة شهر عشان طلعت يقتلونها ويقولون مريضه نفسيا قتلت نفسها حسبي اله
neg	اسهر عشان اتريك اصلا
neg	أصبحت الھواتف تفارق الأيادي لأنھا تعطينا شعور نحبھم قبضة يدينا بدأت حكايات
neg	شارك وقول رأيك بس تقول انت فاهم عشان ده رأيك
neg	صحيح يجبر البقاء الرحيل
neg	يا اخوانا اله لسة مطالبنا أتحق مطلب عليكم اله الناس تخاذل
neg	الهلال الاهلي هلالنا نعرفه المباراة الجاية تقل اهمية ويمكن اهم وياليت زوران يوتر اعصابن
neg	وبوي وذ لوف وصلت رحت ساعتين وكل
neg	حسين عبدالغني حسين غني ياكثر ماتحركت يده اليسار سوء الاخلاق
neg	رب جدة كمان
neg	عبداله باله ريتويت صدقة امي اليلة الماطرة تكفون ادعوا لامي بالرحمة اله يبشرني
neg	تويتر العراق الملعب دية أنتحاري والأدهى أشتراط وضع أسم سلمان
neg	أعان اله قلوبا أحبت بصدق فنخذلت
neg	دخلنا بآخر دقيقة
neg	لسته الناس هنهار بسبها هتشلني بتزيد الموضوع بيصعب واله
neg	رساله مش عاوز اكون لوحدي
neg	اسرع سنه بالتاريخ
neg	بنات يعلق تخاذلو
neg	مشان هيك قص سيارة عرسي خير رح كرسين بس واله يهدي الجميع
neg	لاتأخروا سمحت إحنا جيعانين
neg	اناكحلت عيوني الابتدائي الثانوي الحمدله
neg	ماعندي غيرك
neg	تذكرو رئيسنا البشير ايك ياخ ده الرئيس القبل الفات
neg	هيني نزلته بس لسة جربت
neg	التشيكي مرشح بس اله يكفينا شره خلونا رافشان تكفون النصر الاتحاد
neg	بغيناها هالاجواء الجميله
neg	رئيسين يومين قالو الربيع العربي نحنا الكتاحه الأفريقية
neg	اموت واعرف مين هيجيب الجون السادس
neg	ايس كريم مباكلش ايس كريم بقالي اكتر اربع سنين
neg	السبيل وصالك دلني
neg	لاينبغي الرجال نكون حكرا لامرأة واحدة جريمة مروعة بحق الرجل
neg	الناس تدمن اغاني وانا مدمن عيون
neg	حنا يشقونك مايجي الزون الثالث
neg	الهم امين
neg	واله الهلال قاهرني بس يلا مو مشكله نحط الحره الهدايا
neg	المشاعر هاليله تقول مازلت الأول أبد ماتغيرت القديم بطيبتي وبصفاتي
neg	بالتوفيق لجميع تابعني اتابعك هادي أقوى حسابات فولوباك زعيم تويتر فولورز اهلاوي
neg	يستاهلونه وقليل بحقهم
neg	لالا دا كلام اشاعات ساي ادونا البراهين
neg	كنت بدور الفترة فات سب يخليني أكتئب والحمدله لقيت انهاردة السب
neg	يوما سينتهي الخراب وستنبت الارض عمارا جديد سوريا
neg	كمان أقل القلقاس زعلت بجد
neg	الهم اشفي فرح البلوشي وطهر جسدها واسكب انهارا الراحه
neg	الخير مليتو بصراحه انا مليت حدا عنده تعبير
neg	وغرد الحمار قائلا رآهم رسول اله لقال رسول اله قومك ترى سيقول
neg	ارجوك متمشيش انا بشوفك وابصلك بحس بامان ارجوك مش عاوزة الشعور ده يضيع مني
neg	وداد امورا جاطت دا الحصل
neg	غلطت كنت بحط هذي
neg	تخش طعنة العدو يعرف اماكن الضعف فيك اخش طعنة الصديق شخص خبير فيك
neg	لعب فينا البعوض
neg	اسوأ الحظات بحياتي
neg	تلاتين بترقص اليلة رقصتنا بكي دي حلاوة شديدة باخ
neg	عب ماعندي رصيد المحمول
neg	نطالب بفتح مكبرات المساجد حسبنا اله واله قلة ادب مالقيو وقت رمضان والتراويح نحس برمضان واجوائه
neg	الخير
neg	تقول الأم أفعل شيء أني أخذت الهاتف كي يضعف بصره يرفض الصلح
neg	هيه عرفته افا بس افا
neg	اقرفوك الصبح
neg	مناحل ابو سلطان اقسم باله عسل سدر طبيعي مضمون
neg	طاعة سيدي
neg	قريب يعني تحمست
neg	كميه لطافه بالفديو بصيح
neg	ماهي خطوات الحصول الجنسية السودانية
neg	يلا نلعب
neg	بكتبلك حرفي ومضمونه عزايم لآخر العام لاهنت واعتبرها كوره وضربت بالقايم واخر دقايق انام لك انت
neg	رحل منهو يسليني وصار قبره رحل عني وفارقني حزين صرت حسره ذكرته يحاكيني والبسمات ثقره أختي
neg	اله غفور رحيم
neg	عزيزتي المحجبة نص شعرك طالع الحجاب اختراع اسمو قمطة صارت موضة شغلة
neg	تلاتين بترقص اليلة رقصتنا بكي دي حلاوة شديدة باخ
neg	انتظرك ولازلت متمسك فيك وغيري لأسف فيك يقهرني
neg	سنه لح تشتهو تكونوا بشر ترخولي التويت
neg	صالح المطلك سأقابل اله بوجه ابيض اسرق لعد منو سرق اموال النازحين
neg	بوم اوك
neg	ياخي اقعد تالي اليل مليت
neg	مناحل ابو سلطان اقسم باله عسل سدر طبيعي مضمون
neg	وبعدين طياره لرياض وخلصت الحفله
neg	اسمها قلومي
neg	مينفعش ارجع شهور لورا ليوم كده وهبقي مبسوطه واله
neg	اله يعينا الحين استعراض انا بار بأمي الأم غلطانة يركب العرسان ناقص تنام بينهم الفند
neg	شوفيه احسن ينحرق
neg	الدمام والرياض أمطرت واحنا باقي
neg	
neg	ردوا يمه يبه الأصوات أساميهم يتيم ويتيمة كليب ليتامى
neg	وهيذكر التاريخ اني فضلت مبلط الكلية لحد مواليد دخلو عليا وكمان مواد بحضر معاهم انا موستاءاء
neg	اشتقت لك
neg	رجل بغداد وبقربه طائر القلق بعشرينات القرن يعتبر العراقيون الطائر مؤشرا لسلام لأنه يختار المدن
neg	عادي شاء اله يارب
neg	يازين الفحول تهيج
neg	والرياض
neg	مرحوم يالي موتك تاكدت الحياة بدونك خسارة المشاعر هاليله تقول
neg	بعدني مشتاقيتله
neg	بطلنا نوثق بحدا
neg	يا ليل قربلي بعيد المسافات تعبت انآ يا ليل روحه وجيه يا ليل تدري امر المعانات ذمتي يا
neg	الحين الناس بتقول عيزين نصلي نقرب ربنا عشان الموت بيجي فجأة طيب يعني انتا جاي تصلي الحين خلاص الايمان نز
neg	يعني بكره اشيله لان مر
neg	الخير
neg	أنها كئيبيه وتجيب الضيق اله يشفيك ويعافيك
neg	أتمنى التشكيله
neg	عظيم أيها العراق
neg	طلا بود خب
neg	يهذري المهذري إلا حر السخونة تنهيقة ليست تغريدة
neg	مقطع ضحكني هالفترة
neg	روزي الفاهيه
neg	بس ابا ال
neg	الرياكشن الوحيد اتحمس ديزي مايبالغ وكلامه يجن واحب شخصيته
neg	أتحداكم تقدروا تحلوا الغز ناتج المعادلة يطلع ملاحظة الحل الصحيح رد امطار الشرقيه
neg	افا هذي اخرتها نرد نشيد الاتحاد طول عمرنا نهايط ونقول الهلال مايهمه وفوق الجميع والحين ندور الفزعة فريق
neg	شفتوا ياعيال بسوي نفسي ماشفت التغريدة ذي وأنتم سوا حفلة تخرج الامتياز مافيه مانع
neg	الزوجة سيئة يقولون لزوج تزوج طلقها لتأدب الزوج سيء يقولون لزوجة اصبري عشان العيال ادع
neg	وغيوم ومطر تعويض الكئيب
neg	الحلقة الثالثة وبالشوط بدا التشويق
neg	تنظير تنظير تنظير
neg	بنشكر اله انو القلب عضلة مو عظم بضل التعضيل ارحم الكسر
neg	الدنيا زائلة انا راجعون
neg	بالمعلقه الشوكه هدلع يعني
neg	مستحيل الشعر يوصف تفصيله فجمالك والغناء كفايه غنوه أغنيها لك
neg	باي مكان
neg	مافي الخير
neg	بعلمك معنى فراقي ضيمه
neg	اكيد
neg	احب اعرفكم عيب كبير عندي انا باعرفش اسأل حد انا فعلا بالك فإسأل انت وبلاش تدخل تقولي انت بتسألش ليه
neg	خليك عايش طول حياتك معاك شهادة حسن سير وسلوك عشان تموت مش هتكون مجرد حبر ورق
neg	موب
neg	لكل متابع
neg	فترة غياب اعتذر الجميع عندي ظروف ودعواتكم يسعدكم
neg	واله اسطورية
neg	السبت
neg	وانا احتري قلبك يلين والناس تقدم وانا ارجع ورا
neg	أسلى طيفك الين إنتعشتك عشان ماحس بغيابك طول ياجعلها ذمتك ماوحشتك تصميمي
neg	نترقب الحظات
neg	شهادات جاهزة ومتنوعة تجدوا انواع لشهادات تفوق تميز تحسن مسابقات لوحات عبارات
neg	مافي فض اعتصام توجيه تجمع المهنين يا سودان مافي فض اعتصام توجيه تجمع المهنين يا سودان مافي فض اعتصا
neg	اسمع كلامك اصدقك اشوف افعالك استغرب الم تنعتوهم بالمجوس وحاصرتم قطر بسب إيران وتحاربون إيران اليمن يا قو
neg	الدنيا مبنية التعب
neg	اله يسامحك يا ضياء
neg	تعلم سطايفي بالضبط ولمان حكمو عندو قناطر بصلة ضربوه بروسي والشاحنة سيزي وال
neg	ابشركم فتح
neg	تلاتين بترقص اليلة رقصتنا بكي دي حلاوة شديدة باخ
neg	البعض يقترب منك لمواساتك ليطمئن انك تالم
neg	مبادل جدة المكان متوفر بقي المبادل الجاد المربرب مو متوفر بدات عيوني تقفل نوم
neg	فكرة لفرض رسوم التجار مرفوضة بعذر انهم يريدوا ينفروا المستثمرين ويشردوهم وأي فكرة لفرض رفع رسوم
