type	tweets
pos	يتحول نود نقوله دعاء تبحثوا فينا إنا مكسورون القوة
pos	النهاية يبقى معك آحدإلا الجمال روحك أمالمنبهرون بالمظا
pos	الخير
pos	زلزل الملعب نصرنا بيلعب عالي الهمه ترضى بغير القمه مجرد ساعات لاستعادة الصداره الوصول القمه مهارة
pos	الشيء الوحيد وصلوا لعالمية المسيار ترى كانوا يشجعون مدريد النصر
pos	الاتحاد النصر لاتحسبونا نسينا يالطواقي ولانبيكم توقفون معنا ماحنا بحاجت جماهير مسيار الايام شجعت الكوري
pos	احبك انت وياه واموري سعه
pos	تأمل اله بواد ذي زرع هتف بالدعاء وارزقهم الثمرات مهماكانت ظرو
pos	وينهم يرقصوا زخات المطر خلونا نشوفكم لاه خلفانيات فيروز تحتسي كوب القه خلنا نغير تح
pos	الهم آمين يارب العالمين انتي وانا وامة سيدنا محمد صل اله وسلم اجمعين شاء اله
pos	نمش نوم دا ديل ولادنا
pos	أستغفر اله
pos	تواريخ الرحلات النسائية النرويج مرشدة وادارية خليجية المطار لمطار
pos	السلام عليكم ورحمة اله وبركاته أسعد اله أوقاتكم بكل خير خطة تراكمية لحفظ القرآن الكريم سورة الناس سو
pos	حي اله يبادلني معزه واحترام شيخ الرياجيل خي سيد ريوف
pos	السحب اليلة الايفون رتويت لمرفقة وطبق الشروط
pos	يارب انصرنا يارب النتيجه هيفضل الاهلى جوه عنينا غيره يفرحنا المره الحلوه معا
pos	عمر ترا المشهورات كيذا يصورون والخدامه تلبس عيالهم وتأكلهم وش فيك اله يهديك فلوس جخ
pos	رجل المباراه برأيك
pos	تفكر بالك تعالى
pos	شوف الفيدي اله تكملة
pos	مافي القلب در قلب يسمع أنينه تصميمي سۆمہ قهوه ور
pos	احتزم يانصر معك رجال كفو جمهور الشمس
pos	شراسة الهلال يصبح نادي سعودي يحرز هدفا البطولات الموسم الدوري السعودي
pos	بكره الصداره ترجع لرجالها
pos	الخير الهم طهر صباحنا وصباح مسلم الهم والحزن وافتح لنا أبواب السعادة والأمل
pos	اجمل غنى عبد الحليم العندليب محمد عساف
pos	الهم أرنا عجائب صنعك دعائنا وأرنا لطفك ورحمتك قضاء حوائجنا وأرنا كرمك وقدرتك تعلقت قلوبنا وزدنا
pos	العيون ترى وجوها جميلة القلب يفتح أبوابه إلا لوجه
pos	السيسي الشخص الوحيد يقدر يغير رأي ترمب
pos	آلهم إني أسألك الخير كله عاجله وآجله علمت وما وأعوذ بك الشر كله عاجله وآجله علمت وما
pos	مرتدة تدرس الزمن الجميل الهلال
pos	يغرق ويشغل الدفاع
pos	صرت بدء با ونهو
pos	لأولئك يسندون الجميع يسندهم اله يعرفكم جيدا
pos	الهم اغسل قبر حبيبي احمدعتيق بالماء الثلج البرد طيب ثراه يلقاك مستبشرا
pos	صباحك سعاده
pos	بمناسبة فوز الهلال سحب آيفون رتويت وتابع السحب ساعة موثق بالفديو
pos	يجي غيرك ويرسم لي الهنا حب غيرك بكل قناعة رافضه
pos	ملاحظة محلها لابد ماتكر المباراة القادمة شكر احمد الحربي
pos	ظهور لكرستيان بيل الراحل عمر الشريف
pos	اليقين الهم تدبيرك يغني الحيل
pos	تكونين عظيمه فعليا همك الوحيد شلون تكونين رايقه
pos	الإمام ابن القيم رحمه اله تعالى ير نعمة اله إلا مأكله ومشربه وعافية بدنه فليس
pos	استكمال القاء توقفه بسب الاحوال الجوية البكيرية حطين نهائي دوري الدرجة البكيرية
pos	يأتي الإهتمام إلا قلب يخاف غيابك
pos	يقولون نشبه نامق متصور صورتي غصب تصدقونه المقاطعة مستمره وتمد
pos	أبي رمشك يغطيني وأبيك أقرب أنفاسي يلى بالى
pos	غراس الخير أتدري يسرق عمر المرء بأن يشغل يومه ارتقاب غده يزال ينقضي أجله ويده
pos	انت وحظك اله يعوضك خير
pos	يا فانزات
pos	صباحك سعاده
pos	الطيبون بائع الورد تشتري فرائحته دائما طيبة فأنتم الورد وأنتم رائحته والنفس الطيب
pos	الاتحاد النصر وقتها النصراوي يتعشاء العصر وينام
pos	ينتزعوها ليفرطوا بسهولة ثقتنا كبيرة بأبطالنا ومنصورين بأذن اله
pos	أدعية لٱ تنساها الهم إني اسألك حسن الخاتمة الهم ارزقني توبة نصوحا الموت الهم يا مقلب القلوب ثبت قلبي دينك
pos	دعم إداري شكر وتقدير لك عالتفاعلك حساب ميز راقي أنيقه أدق تفاصيلها نقيه روحها
pos	بمناسبة فوز الهلال سحب آيفون رتويت وتابع السحب ساعة موثق بالفديو
pos	تمت الترجمه
pos	الهم اغفر لمسلمين والمسلمآت والمؤمنين والمؤمنآت الأحيآء منهم والأموآت
pos	شايل كبير حسبي اله إله إلا توكلت رب العرش العظيم
pos	وين انت ماهي وين انت دايم وين انت هالمره الفين وين انت
pos	سن الحب احبته احبت شيء يتعلق احبت يذكرك نحب الجمعة لأنها يومك نحب الس
pos	ظلمة اليل حالة الهدوء إختم يومك بصلاة الوتر فإنها سكينة لقلب وطهارة لجسد ودعاء مستجاب بإذن
pos	المسرح سيأدين بلاك بينك ابريل
pos	صوت مريم ينسيني مره الحياه
pos	لربما انك باحث الاغصان عما يظهر الجذور مولانا جلال الدين الرومي
pos	مثلك وشرواك بس باقي اشوفك واحكم
pos	بعرف اني اسوء حالاتي بتجه لساوند كلاود افتح بلاي ليست مسار
pos	ابشرك ابو سامي بخير الحمد شكرا لك
pos	التهميش حل لڪل شخص يحاول إنو يصعد السطور مالھہ مڪان الصفحھہ اساسا
pos	يسعد صباحك ورده
pos	يسلمو ركاد الادارة بكم نرقا سما تميزنا وتفردنا بالعطاء
pos	صرت مدمنه القهوا
pos	ماتقدر تقوله وليش الكاميرا الخفيه لأيام زمان
pos	وأنت عيني مدينة قمرها وظلالها وسكانها
pos	اسأل اله هذالصباح يرزقني ويرزقكم بصيرة ينير دروبنا يهب لي ولكم سكينة يشرح قلوبنا يمن
pos	البداية كلية تجارة انجليزي جامعة المنصورة
pos	بيجلد بينجلد
pos	الحياة مجرد صفحات نروي القص تايه اجمل احساس لدعم
pos	حكمه رائعه يرى يومه يستحق الابتسامة فليغلق عينيه دقائق وليعلم رؤية النور وحدها تستحق ال
pos	يارب أجعله أصحاب الآية
pos	بمناسبة فوز الهلال سحب آيفون رتويت وتابع السحب ساعة موثق بالفديو
pos	انا اقوى فتاة ضعيفه واضعف فتاة قوية أردت اكون إحداهن اكون
pos	الصباحيه بقولك
pos	الناس السهرانة كوت التويتة صلوا النبي خلوا عندكم يصلوا صلى سيدنا النبي صلاة واحدة صلى اله عشرا
pos	الحمد مباراه صعبه بتوفيق اله دعمكم تجاوزنا المباراه
pos	الشعارات الزائفة المغلوطه المضلة يردها الخونة المنتفعين لإسترزاق والمتاجرة بإس
pos	عذر مقنع النت خصوصية وماهي معتقداتك الخطيرة اصلا ورود قبلات وقوس قزح
pos	يافالق الإصباح والنوي وعالم السر والنجوي نسألك صباحا كله خير وعافية وعفوا لدنك ياخير سئل وأجود أع
pos	اله يبلغنا رمضان واحنا بأحسن حال
pos	الأمان تشعر بأحدهم مسكا قلبك بيدك استودعكم اله لاتضيع ودائعه سبحانك الهم وبح
pos	الحين مو تقولين الجدل الفقهي والنقاش العلمي مو مكانه ليش بديت تجتزئين وتحاولين تظهرين ضعف القول
pos	ابشرو يازعماء اسيا احتزمتو برجال مواقف ابشرو بسعدكم اليلة نمردغ الفقر
pos	الخير الجميع الخير
pos	مباراة العربية غوميز استفز وتلفظ المدافع الشاب عبدالباسط هندي حينها جهلة المدرج الإعلام الجاهل ضحكوا وتن
pos	النبي صلى اله وسلم أولى الناس بي القيامة أكثرهم صلاة الهم صل وسلم نبينا محمد
pos	تقولي لي مناري استحيت منك ياكلبه عادي قولي تكفى واسوي لك قهوه
pos	هكذا يصنع البعض بأرواحنا
pos	تسلم ابو
pos	تعدل النت وشفتها
pos	نفسها مرتين
pos	جماهير الهلال الغربية نجومية القاء لمعيوف
pos	الفل الناس الكل الخير يا وجوه الخير شاء اله نهاركم سعيد مبارك جربة تونس
pos	وين تحط قفل حسابها تزوجك الحوب وإلا باقي
pos	القرآن اكتر حاجه بتريحنى نفسيا
pos	سنه وانت طيب يا كهربا ويارب تعقل كده وترجع زي زمان وتركز شويه
pos	الابتسامة الحلوة والغاليه وجوهكم الطيبه متابعيني الغالين ولمن يقرأ
pos	اجعلني يارب نورا يأفل هديه ومطرا يكف ريه وحدائق بهجة
pos	أدري فقدتك بس لازلت أبغيك وإذني العذال تزال خرسى منيف الخمشي
pos	اله يبلغك رمضان وانت بأحسن حال يارب
pos	السحب اليلة الايفون رتويت لمرفقة وطبق الشروط
pos	صح وأحيان كثيره مودكم يهمني
pos	حق زماله
pos	الصدف الحلوة يجتمع الحب والصداقة
pos	تنحني الحروف خجلا لمدحكم اعتليتم السماء حسابات ملكيه نفتخربتواجدهم كوكبتنا الراقيه صنعوا الابداع تمي
pos	يا حياتي ليش خوفك وانتي بعيوني اشوفك وربي اخونك عطوني شي يابعدهم
pos	ويوسف مكر إخوته يظنها الأخيره ويوسف ظلمة البئر يظنها الأخيره ويوسف الرق يظنها الأخيره
pos	الساعه تجديد رصيد الاعضاء لكل عضو تغريدات باليوم بتفاعلكم نرقى لتميز لانضمام ارسل اض
pos	الفقراوي يوقف هيبة زعيم اآسيا حقيقة
pos	اشهر وبضعة اعجتني كلمة وبضعة ترى جلست ساعه علشان اكتبها تعالي خذي الزرقاء ام جود
pos	حاجه رتويت حقيقي وبشكل يومي لتغريداتك أكثر رتويت لتغريده الواحدة وخلال ساعه
pos	ياعمري انا
pos	اله ينعم حالك
pos	اتمنى ماشوف النصر بالشكل ويارب مايجي انت غيرك يشوه صورة النصر واشوف العالمي
pos	ماهي هاليله وبس وانت متغير
pos	عطر اله قلوبكم الطيبة بنسائم المبارك ورزقكم الصحة والعافية وأسعدكم الدارين وبشركم بما يسركم وكف عنك
pos	رغم الطرد مشكوك بأمره رغم الغاء الهدف صحيح نقول يارب شوط اجمل الهلال الاهلي
pos	انا بقا الحاجه تحصل بقا عارف ايه ال هيتم بظبط
pos	بمناسبة فوز الهلال سحب آيفون رتويت وتابع السحب ساعة موثق بالفديو
pos	عمانية وارثة قيمته حر ورثته جدها انظر واسمع تقول درك
pos	ترجتوه بالاخر
pos	اتابع مسلسل
pos	الوضع امان الحمدله ماف انباء اصابات لحدي الحظة الحصل انو كجر مندس ضرب رصاص بالتزامن قناص
pos	يقولون التامل ربي عباده يصير اتاملك وأخذ اجر
pos	الهلال الاهلي فوز هلالي مهم الحمد زوران بيسلم المباراة تبديل كاريو بإنتظار الإتحاد بكرة يارب يار
pos	جزيتي خيرا كثر اله أمثالك
pos	الهم جمل صباحنا بذكرك وطهر أوقاتنا الهم والحزن وافتح لنا أبواب السعادة والأمل الخير
pos	تزرع ورودك حدائق الآخرين لتسعدهم فيتذمرون أشواكها وينسون أنك زرع
pos	رب أجعلة صباحا ينثر طعم الإبتسامة ثغر السحاب تمطر لنا نشتهي مشيئتك
pos	عيدي يا اختي
pos	الخير
pos	الشيء الوحيد وصلوا لعالمية المسيار ترى كانوا يشجعون مدريد النصر
pos	انا مش ملاك رسول بس مكن ابقي حد كويس وانت معايا
pos	اوزع لفات كلمن شهر ميلاده لفة بيض لفة جبن تريده قلبي لفة كباب حض لفة طماطه
pos	إل إلا اله محمد رسول اله نبض قلبك ونور صباحك وبركة يومك الهم أعطنا خير عطاياك يا كر
pos	تطير طيور غيرك سماي انت الغيم والباقي
pos	حسآبات تميزة بتفاعل بعضهم لعطاء قامة وفاء معرفتهم شرف لنا وأنتم منهم
pos	مباراة العربية غوميز استفز وتلفظ المدافع الشاب عبدالباسط هندي حينها جهلة المدرج الإعلام الجاهل ضحكوا وتن
pos	يلاقيها الاهلي البشير
pos	تفرط صلاة الضحى دقائق السعادة والصدقات الغزيرة صلاة الأوابين سباقا لربك أوابا
pos	ملاك روحي نامي عورني بطني واله اقول يارب تقراء
pos	الاجواء الحلوه
pos	يكثر الحديث عنك سواء مدح ذم فتأكد بأنك شغلت حولك لدرجة أنهم تركوا يعنيهم واهتموا بك فواصل نجاحك ودع
pos	شكرا بحجم الكون العطاء النقي الصادق والمعتاد قلبك المحب وروحك السامية اخجلني كرمك وسعدت
pos	شو رايكم
pos	ايوه ايوه حبيبي انت ألجمهم باله عجزت افهمهم
pos	انا قويه باس ماتبع الناس والي يقفي ماحسبنا حسابه شيخه وفيني فرق الاجناس هيبه ملوك ورث ماهي
pos	مش فتوى مضحكة
pos	نتمنى لنصر النصر باذن اله ولاتحاد البقاء بس ماهو حسابنا الاتحاد النصر
pos	الناس كلها تمنالك الخير ترا بشرط انك احسن منهم
pos	تهزمك دنيا ولن تغلبك أوجاع ستجتاز الحياة بأمان قل دائما الهم إني اعوذ بك جهد البلاء درك الشقاء وس
pos	مافي القلب در قلب يسمع أنينه تصميمي سۆمہ قهوه ور
pos	شيخة عرب بنت العرب وبنفسها معتزه طيب ونسب زين وادب والي تبيه تحوزه مثلها قدها واقوى شعور اته
pos	الهم أذهب عنا الحزن وأزل عنا الهم واطرد نفوسنا القلق واجعل لنا فرجا ضيق مخرج
pos	يلاقيها الاهلي البشير
pos	ربي رزقني صديقه صارت الحياة طعم ربي يخليك لي سنسون
pos	الخير
pos	أظن انا جاني الدعاء
pos	ردة فعل لينا اختي صحت وشافت ميك اب امي طالعه
pos	ريتويت أخلاقك بتسمح ليك تسلم البشير
pos	بيتصدر يصبح علاكم زلزل الملعب نصرنا بيلعب
pos	تعليق
pos	حينا خفة العصفور وحينا كبرياء الطاوس ودائما ودآعة الحمامه المستأنسه الرافعي
pos	صلى اله وسلم شهد إله إلا اله محمدا رسول اله حرم اله النار صحيح الجامع
pos	وإصبر لحكم ربك فإنك بأعينا
pos	سنه أمسي عليكم يرد أستسلم الخير لتماسيح
pos	حقي غبت ذكراي بالخير وحقك غبت محدن يعرفك
pos	بمناسبة فوز الهلال سحب مبلغ الشروط متابعة حسابي فولو رتويت
pos	لأداء المعروف آداب جعفر محمد لسفيان الثوري يتم المعروف إلا بثلاثة بتعجيله وتصغيره وستره طيبة
pos	لفة وسائل التوصل الاجتماعي اليلة الشمالين يرحبون بإنفسهم سيئون
pos	إنتهيت قراءتها أعد تغريدها أستغفراله العظيم وأتوب إليه أستغفراله العظيم وأتوب إليه أستغفر
pos	بيقطعوك حت ويقلوك الزيت
pos	انت بمفردك يا فتى معك زملاء الشقة ام منايفة
pos	يارب اشفي ياسين مرضانا يارب العالمين ادعولو بالشفاء فضلكم
pos	قلوب كريمة عرفناها وأرواح عذبة أحبناها وأخلاق تأسرنا بفيض جمالها وسمو تعاملها ورقيها لحيا
pos	فوز الاتحاد يارب
pos	يا ايه انت متعرفيش حقيقي بحبك انت والجروب بتاعكم ايه وجودكم بيحلي
pos	الساعه تجديد رصيد الاعضاء لكل عضو تغريدات باليوم بالاضافه تغريدات بالتاق
pos	يا مرحبا واجد
pos	الأعيون بتحليها يومين ليله
pos	الخير
pos	سلمه ربي الأبطال اله يعطيهم العافية يستاهلون التكريم فزعة ونخوة وتضحية بالنفس ماشاء اله
pos	صدفة حكي قربت قلبين
pos	الشعور متبادل اله يحفظك ويسعدك ويوفقك يارب وردك أجمل القهوه بالعافيه
pos	انت والكافين كافين
pos	النصر ارسل خطاب لاتحاد القدم يفيد باستبعاد حكام يقودون لفريق الجولات القادمة الجزيرة
pos	يسقط حكم تميم نصر الات المكنى بزميره ابليس يقول خميني عربي ابن عربي ابن رسول اله خامنئی عربي قرشي ابن رسول ال
pos	الصباح لنا الخير
pos	كيوت
pos	جمعت مفرداتها حدائق الورود اختارت الجمال سحر براعم الزهر جعلتها معزوفة لحنتها
pos	امين يارب العالمين
pos	التنزيله يعدل محارمي ويكت بنفس القدر
pos	مبروك والفال لك يابو فلاح
pos	الوحيد اغلي مافي الحياه ملاين بتقول أنصره ياله قدها يا اهلي
pos	النصر الهلال مستعدين ستوزع المتفاعلين مباراة الهلال والنصر شاء اله روقان برج
pos	دعاء النون يصنع المعجزات إله إلا سبحانك إني كنت الظالمين
pos	انت الحلو لبى ديودك
pos	صبحك بالخير
pos	الحمد مبروك يازعماء القادم أجمل شاء اله
pos	الهم إحفظ السودان مكروه واكتب حقبة سعيدة مزهرة تنهض البلد التقدم والنمو
pos	يازينها بينهم
pos	الهم اسقي ارواحنا فيض رحمتك وعزائم مغفرتك الهم غيث تزهر القلوب الهم اشفي مرضانا ومرضا المسلمين وغ
pos	اله وبحمده
pos	تأمل اله بواد ذي زرع هتف بالدعاء وارزقهم الثمرات مهماكانت ظرو
pos	وإن تمنيت ربي أمنيه فبقاء عائلتي وأصحابي الأماني ربي لاتفجعني بهم احفظهم لي دمت حيا
pos	ماشاء اله تبارك اله اله يزيدها اله محد جاها وقالها انتي ليش تألفي وتمثلي وتغني وتنتجي وتقدمي عندنا
pos	السحب اليلة الايفون رتويت لمرفقة وطبق الشروط
pos	البيت العرين بعين اله ترعاكم
pos	تعلق سعادتك بغير اله الحبيب يجفو والقريب يبعد والحي يموت والمال يفنى والصحة تزول يبقى إلا الحي القيوم
pos	كثري هالمقاطع عشان تفهم سلوى الزهراني انك تحبين زوجك يصير ماتخطفه منك
pos	الأباء لايشيبون لايمرضون لايتألمون ليتهم معصومين المرض لايحزنون لايرحلون ليتهم مخلدون ليتهم يضلون السند الثابت فناء الحياة
pos	شاء اله خير
pos	مراكز اغنية بالتعاون هالزي المخطات الكورية الموسيقية الساعة بتوقيت كوريا
pos	يارب ياعالى انصر الاهلى الغالى
pos	القلب الذاكرة
pos	حال لحال
pos	لعلها تشفع ليك القيامه
pos	كتر شوقي سبقت عمري شفت بكره بدري إيه يفيد الزمن عاش الخيال قلبه سكن أنعم
pos	الأرواح أوجدهم اله حياتنا كنعم تستوجب الشكر
pos	الغانم العيسى لمقاولات دمشق الرياض جدة تنفيذ المظلات المشبات الشويات الافران هناجر مستودعات ترميمات
pos	هكذا احتفل زوجين طيور القالق نزول بيضة لهما العش
pos	المفترض صورة ليلية بأس بوضعها الصباح
pos	والى التصوير التميلح حاط فلاتر عيونك ومفتح بشرتك ومضبط الحية والحواجب
pos	تريد أشياء تحدث تنتظر شيئا يأتي تذكر العبارة رب خير تنله شرا أتاك سيحدث
pos	عادي شوي ينفس وشوي فلاوي
pos	مباراة العربية غوميز استفز وتلفظ المدافع الشاب عبدالباسط هندي حينها جهلة المدرج الإعلام الجاهل ضحكوا وتن
pos	صح واله
pos	يعني نصراوي قلت
pos	الخير ساعة تماما ماتبقى الكلاسيكو الكبير النصر الاتحاد نراكم
pos	يتنحى عشان يمسك الرئاسة
pos	اكره شي تنام ساعتين وتقعد النوم حلمان حلم يضايقك
pos	ماتمت مناقشته
pos	وياك خوي
pos	الهم أمين
pos	معاك انا يلا
pos	مسابقة الشروط متابعة ريتويت وتدخل السحب بالتوفيق لجميع السحب يومين
pos	يسعد صباحك
pos	أمين يا رب تسلم يالعزيز بو حسن
pos	تاي يصيح بالزاويه
pos	عمانية وارثة قيمته حر ورثته جدها انظر واسمع تقول درك
pos	مباراة الهلال الاهلي أنتهت بفوز الزعيم برباعية بإذن اله يتكر السيناريو لزعيم
pos	تعلمت الحياه المشاركات لجميع أتحفونا بردودكم وخذ رتويت فارس الحاني درس اهدته لك الحياه
pos	يارب يا عالى انصر الأهلى الغالى
pos	ياقلب بالامكان تعبت اناصح وتعصيني غياب لفتره ليست بالقصيره دعواتكم
pos	تبكي ليلة لتفرغ صدرها المحشو بالندوب مرة تنصت النجوم قائلة لطالما اعتبرناك عائلتنا أتنطفئين
pos	تزرع السعادة قلب إنسان سيأتي يزرعها قلبك فالدني
pos	واله يأتيك الخير اضعاف ماتمنيت لغيرك
pos	
pos	الهلال ينتصر بعيد مستواه إهدار غريب لفرص سهلة خط دفاع يعاني كنو إمك
