type	tweetspos	ماقصرت يابوإبراهيم دوما رايتك بيضاء عتبنا قدر محبتنا لك
pos	هكذا احتفل زوجين طيور القالق نزول بيضة لهما العش
pos	احيانا قلبك يريد الميعاد أغني والقلوب بعاد الذكرى معك ياغايبي تنعاد
pos	المفروض استحي دمي وانام بما عمال جاين
pos	اختيار ادراة الفقر واتحاد لؤي وخليل
pos	افعلها يا نصر ارجوك الاتحاد النصر
pos	الهم أسقنا الغيث تجعلنا القانطين مسأئګم اطواق الورد وسعادة تط رق قلوبگم انت
pos	يتحدثون اخلاق حسين ونجوم فرقهم نهاياتهم الرياضية أليمة ومخجلة نختلف ونتفق حسين المؤكد صحيفته الأخلاق
pos	محامي دوله مو محامي
pos	خلصت انهارده وبصراحة المسلسل حلو وعجبني اوي بس قارناه عموما حاجة الفئة زي مسلسل
pos	لعيون الاتي العين يبكي ذكريات العين جلد العميد وبعدها جلدنا العين لعيونهم ذكريات صداقتنا العميد
pos	الاسم لحالة بيسب لمحور الشر جلطة
pos	أروع همسك سيدي يسعد صباحك
pos	هدف عبدالفتاح صحيح ده وقتك يانصراوي اضرب الاهلاوي يصيح النصراوي اضرب النصراوي يصيح الاهلاوي الهلال الاهلي
pos	دمرت أحلام ليفربول جوزيه مورينيو مباراتنا ضدهم أنفيلد شعرت انهم يجهزون لإحتفال بال
pos	القلق
pos	الخير لايعلم مآ تخفيہ صدوركم آلأماني إلا اله بهمومكم وأحزانكم إلا جل جلاله فاطمئنو
pos	الهم دربا تضيق الحياة وقلبا يزول الامل أسال اله العظيم يفتح لنا ولوالدينا لكم
pos	الاتحاد النصر زلزل الملعب نصرنا بيلعب النصر ياعميد بجمهوره عنيد احتزم يانصر معك رجال جمهور النصر يحتاج تج
pos	برافو احسنتي سلمت أناملك الذهبية
pos	حاول ترفع خديك لمسها بيديك ابقي هكذا دائما
pos	سحب مبلغ مالي لمتابعي كشكول المطلوب شي بس رتويت السحب الرتويت لحظة مسابقات مسابقات كشكول مسابقه
pos	الفرحة
pos	
pos	تعطي وعد ماتقدر توفي فيهہ تمثل شعور تحسهہ سهام
pos	يخليلك ياهن يلا المشوار التاني
pos	ابيك
pos	يا سري آلحلو يا مقصدي بگل آلحگي آحبگ جدآ
pos	انجاز بستحق انو نفرح بيهو لكنا انتظار الفرح الحقيقي والاحتفال الاكبر البتلخص تحقيق مطالب وغايات ال
pos	وانا يوكلوني عسل
pos	تايهيونق البحري كواليس تصوير الفيديو الموسيقي
pos	صح لسانك
pos	فديتج واله
pos	رجل المباراة بدون منازع حفظ لهلال نقاطه بإنقاذ أهداف محقة الاعب يهزم الشك والضغط ويعود التألق لاع
pos	دي لغة راندوك
pos	تهادوا تحابوا تسعد القلب وتديم المحبة اهد تحب هدية مختلفة وما عمره جرب فرحتها ساهم
pos	هذي الحياة سر الحياة الابتسامة ومياه تانيا مياه تانيا
pos	الخير
pos	لايك لتويته دي ونتابع الايك تابعوني وفعلوا التنبيهات
pos	غوميز يهايط الشاب الصغير عبدالباسط الوضع فله ويركبون مقاطع ويوم جاء ابو عمر وهجد غوميز صاحوا
pos	أصلح حالي لحال تحبه ياله فما الدنيا باقية لحي وما الحي الدنيا باق
pos	الغلا نجد فطره يلوم القلب حب الرياض
pos	تصرف محمد كنو الهدف ٪ قيمة الهدف لعيب يا محمد
pos	الشيء الوحيد وصلوا لعالمية المسيار ترى كانوا يشجعون مدريد النصر
pos	أخر ريتويت منشن
pos	يارب لي نصيب
pos	حساب متع متفاعل رائعه مبدعه ميزه مغرده متألقه
pos	وكيف لي آنظر غيرك وأنت وطني وأهلي وكيآني
pos	طول عمرى بأقول الشوق وليالى الشوق قلبى عذابه سيرة الحب بليغ حمدي
pos	البليهي يمثل حال هلالي قبله جبين الميز عبداله المعيوف المستويات الاخيره شكرا القلب
pos	كبذور الحب أنثرك أرض جافة قاحلة حياة فتزهو بك وردا وزهر فتسم بالحب بجنانه
pos	النور والجو الجميل
pos	ابي قربك وابيك بدنيتي تبقى
pos	يا توجه اوضاع احوال حاكم بر تفاوت نسل شايد خيلي بي ربط نباشه
pos	الحمدله ونحن نسمع ونبصر الحمدله شمس أشرقت ونحن نؤمن ونشكر الحمدله ونحن نف
pos	يقال عبدالفتاح البرهان المشرف القوات السودانية المشاركة اليمن
pos	يسطا عالمي اله
pos	وضع اله أنسب خطة لحياتك تنفذها تقلق
pos	الجبيل الصناعيه الهم اجعلها أمطار خير وبركة والهم لك الحمد نعمه تعد تحصى
pos	شاركنا غرد بتصميم رعاية يتيم هاشتاق تحدي الألف سهم طبق الشروط وادخل معنا فرصة الفوز بج
pos	انهم يشوفوني بخيل
pos	قوتنا اله دائما مبروك الحمد الشكر
pos	قوتنا اله دائما مبروك الحمد الشكر
pos	بمناسبة فوز الهلال سحب آيفون رتويت وتابع السحب ساعة موثق بالفديو
pos	متحسبوهاش ربنا حساباته احلى
pos	يارب إني استودعتك أدعيه قلبي لايعلمها سواك
pos	غوميز يهايط الشاب الصغير عبدالباسط الوضع فله ويركبون مقاطع ويوم جاء ابو عمر وهجد غوميز صاحوا
pos	ابن الجوزي رحمه اله وانظر حالك يصلح لموت والقبر فتمادى وإن يصلح لهذين فتب
pos	اليا شربتوها انتوا مساكين صرتوا الدهاة تحل القضايا
pos	صدارة بس الصدارة فضلت الهلال شهور النصر ماكملتش اسبوعين الصدارة مش طايقاه
pos	الاجواء الجميله
pos	الاهلي ولاعبيه وجمهوره ماقصرتوا رغم الهزيمة انا لست بحزين واله شكرا الهلال الاهلي
pos	ريتويت أخلاقك بتسمح ليك تسلم البشير
pos	
pos	القلوب الجميلة لهآ رائحه تجذب البشر
pos	اهلاويه لنخاع
pos	وانا مانمت لي الحين
pos	أعظم نعيم الجنة الإمام عبدالعزيز باز رحمه اله
pos	مفروض تجربي عشان تقدري تحكمي صح كمن سمع
pos	ابو عمر رياضي سعودي
pos	صوره تمثل مشاعر الهلالين مايقدمه الحارس عبداله المعيوف مستويات متصاعده كافة الاصعده
pos	أغلبنا ينظرون لأشياء منظور نراها زواية أخرى المكن تقلب مفهومنا لمغزى وراء الحدث تماما الخير
pos	الوطن الشعب النصر انتهى الجهاد الأصغر وبقي الجهاد الأكبر والاعتصام قائم مدن السودان تنتصر
pos	موفقين جميعا معك محدا خسران
pos	شلونكم يابنات
pos	يتحدثون اخلاق حسين ونجوم فرقهم نهاياتهم الرياضية أليمة ومخجلة نختلف ونتفق حسين المؤكد صحيفته الأخلاق
pos	السحب اليلة الايفون رتويت لمرفقة وطبق الشروط
pos	آلعيون تحدثت بلغآتها قآلت مقالا يقلهہ خطيب
pos	باسمك الهم نبدأ يومنا راجين رحمتك متوكلين متبرئين حولنا وقوتنا ملتجئين حولك وقوتك ربنا نسألك بعظمتك
pos	اوبا ليو بتاعكو
pos	بمناسبة فوز الهلال سحب آيفون رتويت وتابع السحب ساعة موثق بالفديو
pos	الهم أبعد عنى يستحقنى هان حزنى تعلق قلبى بشىء تكتبه لى دائما ضع الأمل حياتك لتستمر وثبات تغيرات الحياة تفائل دوما وانهض جديد وابتسم لتبتسم لك الحياة تصرف محمد كنو الهدف ٪ قيمة الهدف لعيب يا محمد تبقى الوحيد بخافقي ماشطبته ملكني بالغلا احتواني اخذتني كلي عقلي نهبته لاتلومني صرت بك أناني توقعون تلقي القبض الحكومة القطرية توقع بي اتحفوني توقعاتكم بس ابعدوني الخازوق يا معصيتي راحتي انا اجيت يسعد صباحك شهور تعال خذ الزرقاء فريق التماسيح تعورني فكرة إني رح أكمل بدونك يا رب الجنه اله يبارك فيك يا دكتور تستاهل الطيب آمين يارب صباحك جمال كحضورك اله وبحمده اله العظيم بعيدا مستوى المعيوف الميز هالقطة أسطورية ناصر صباحك كله حلا الهم دربا تضيق الحياة وقلبا يزول الامل أسال اله العظيم يفتح لنا ولوالدينا لكم أبواب ابوي نصراوي انا واخوي اتحادين امي هلاليه بس ماتابع التواضع والرحمه والكلمه الطيبه أجمل مايتركه الإنسان قلوب الآخرين فالحمدله يارب عائلتي أحب وكل يقرأ ودائعك الهم أرزقهم لطف القدر وصحة الجسد وطيب الخاطر وعافية الدهر الهم أحفظهم كلام إعلامي يظهر قناة حكوميه الدعوه سايبه يا حبيبي قبلها اساء لحمداله إلتزام بالحياد احترام مشاء اله الهم لك الحمد امطار غزيره مدينتي الجميله الهم صيبا نافعا الجبيل الصناعية هذي الحياة الماء سر الحياة تعالى وجعلنا الماء شيء حي اله يرزقني الفوز يارب وين الاذلال خي ترى عادي شفيك محسني انكم فايزين علينا بخمسه يطلع منكم فايده يوما ستشكر نفسك الاستسلام طالع ميتيني هروح انتحر خلاص بس انت اكتر يسط واله المشكلة مو زين مو زين ولاكن الادارة الموجودة جابتة الحين شنوا رد الموالين دمه خفيف احسن التمسنا العذر لغاضبين وأحسنا الظن بالغائبين نغضب نغيب وندم ونعود معتذرين السعاده دايما صباحي اسألك إلهي يكتمل يومنا بلا تعب قلق حزن وبك اصبحنا يا اله الخير الصداره بيدك نصراوي احضر المدرج وشجع وبأذن اله ترجع الصداره الهلال الاهلي زلازل الملعب نصرنا بيلعب صاحبه التويته مش ال الصور ونقطه العيون دي النقطه ال اتفق معاكي الباقي ال بتقوليه دا يضحك والبنت اله اله زلزل الملعب نصرنا بيلعب النصر الاتحاد تبقى الوحيد بخافقي ماشطبته ملكني بالغلا احتواني اخذتني كلي الأمنيات البيضاء السعادة نتمناها قلوبنا وقلوب نحب اقوى ريمونتادا تاريخ برو كلوب تصميم فيفا فورتنايت عسل المجرى لمتزوجين أفضل المقويات الجنسية بمكونات طبيعية بمناسبة فوز الهلال سحب آيفون رتويت وتابع السحب ساعة موثق بالفديو تبغوا حكام وفار خليل جلال ونعم ونعم وبرضة سؤال غبي مايرد سؤالك عمانية وارثة قيمته حر ورثته جدها انظر واسمع تقول درك لابسة احمر ليه يا انتي ايه المناسبة محد ارسلي رسآله إعتذار بنهاية معقوله زعلت بذيك السنه انا رائع حسرة صالت جالت بخاطر الأيام فقدت عداد أصابعي بحة حكي بوح الحظة أدب معتق عمانية وارثة قيمته حر ورثته جدها انظر واسمع تقول درك تصدقوا بأن الكلمة فصيحه اقصد الفالوده فالأصل معاجم الغة فالوذج حلوى هلاميه تصنع الدقيق والعسل صباحك سقوط برهان وتسقط تالت ونجي لي جيرانا كلا عنده يسده القطات يتحدثون اخلاق حسين ونجوم فرقهم نهاياتهم الرياضية أليمة ومخجلة نختلف ونتفق حسين المؤكد صحيفته الأخلاق دخلتم بوجه التحالف ومثلما ضاق عليكم الجنوب عدن المهره سيضيق عليكم الوادي وستخرجون اذله صاغرين جمهور الفقر بالذات بوتيا يكشف لوز فهد المولد مطرنا بفضل اله ورحمته رجا لاحد يكلمنا مابي يتعكر مزاجي شفت ذولي الجميلات والطيفات اله حدثت اله عنك أخبرته قلبي معقود بقلبك وأنك أشد أشيائي حبا ودعوته يبقيك لي ومعي نبراس قلبي واله يفوز النصر الهلال مافاز باقي الاتحاد يفوز ياصباح التباشير الزمن الجميل الزمان بلا كذب ونفاق هذاك يسمونه زمان الطيبين اجدادنا العفه رفاق زمانهم زين زم توكلنا اله وانا قاعد اشوفك انت تحلق بالسماء ادري صورتك القائمة الأساسية والاحتياطية لفريق الهلال الأول لكرة القدم مواجهة مضيفه الأهلي الجولة ال دوري
pos	عيونكم فوز الهلال يعني دبل مرحله بطولة الدوري الهلال يعني تدبيل مرحله مرتين
pos	فيديو الهلال يرصد كواليس مباراة الهلال الحزم غرفة الملابس الهلال
pos	مش هنقابل زيهم تاني
pos	الهم بارگ لنا حياتنا أگتب لنا الخير أهبنا الصحة والعافيه ويسر
pos	نجدهم يطوفون حولنا بطهر قلوبهم ورقي أخلاقهم مبدعين بحروفهم أنيقين بحضورهم ميزين تفاع
pos	شاهد امطار الرياض تغرق وتدمر المنازل وهيئه الأرصاد توقع امطار اشد واقوي الرياض وبعض المدن الاخري تعرف
pos	الإبداع عالم المستديرة يقتصر المهارات الفنية كيفية تسجيل الأهداف يبدع إحتفاله بالأه
pos	حسين ماهو راعي استراحات سهرات آخر اليل مشاكل الطياره مضيفات استخدم السحر وراح يستغفر
pos	زوران يفقدنا المباراة فوز بمجهود الاعبين شكرا مبروك يا زعماء شاء اله نكملها الاثنين
pos	أسأل اله العظيم رب العرش العظيم يشفيك حفظك اله جمال والحمد سلامتك
pos	الهلال والنصر الهم اعاد التغريده يسر امره وفرج همه ونفس كربه أسعد قلبه
pos	قرأ سورة الإخلاص مرات بنى اله بيتا الجنه المقابيل لدعم ملكة خالد الهيلا اسطول زعماء تويتر
pos	حسابات ملگية مغردون ميزون حضور أنيق وحروف رآقية حسابات ملكية تستحق المتابعة
pos	يارب قطرات المطر أستودعتك أدعية قلبي يعلمها سواك ربي أمطر قلبي فرحا ينتهي حق أمنياتي الهم اج
pos	ام كلثوم الاطلال
pos	الهم صل وسلم وبارك سيدنا محمد بيته الطيبين الطاهرين
pos	معك عرفت إمكاني الإستغناء العالم بأكمله مقابلك انت
pos	يابخت قلبي جيت وسگنته ويابخت نفسي دامك انت نظرها خذ راحتك قلبي ملگته ومگانتك داخلي ياگبرها
pos	النور
pos	الجمعة يتم السحب بإذن اله فالكم التوفيق جميعا
pos	صباحك سعادة ورضا الرحمن
pos	اوف قوي تفكر حد يزعل تقول دحابشة وبعدين قولي
pos	الهم صل وسلم شرحت القلوب وأنرت الدروب وهديت الضلالة وعلمت الجهالة
pos	آخر فوز نادي الأهلي الهلال أعوام
pos	انت قدرت وبصيت السما والي
pos	ابدا انتي الصح انا الغلط
pos	الحمد مبروك يازعماء القادم أجمل شاء اله
pos	الجمال
pos	السبت
pos	هاي يا هيما يا قلبي اولا العميد بس احمد حسن الطبيعي يسحب القرعة
pos	اله تعالى اله الرزاق القوة المتين لك سيأتيك رغم ضعفك وما لك
pos	حياه البنت مرحلتين قدام المرايه اناصايره دبه لازم اضعف قدام الثلاجه يبيني ياخذني انا
pos	ياصباح النور والسرور
pos	السحب اليلة الايفون رتويت لمرفقة وطبق الشروط
pos	الهم طهر صباحنا الهم والحزن وافتح لنا أبواب السعادة والأمل طبتم وطاب صباحكم واسعدكم اله أينما كنتم يسعد صباحكم
pos	لاسف سيغيب الاعب منصور الحربي مباراة النصر بسب الاصابه
pos	ربي يجيبك لي الوصل تفرح بك
pos	اتمتعوا بالوقت معاكم متستنوش بكرة طول بتعلقو سعادتكم تخرج جواز خلفة شغل غيرة هتفضلو تعساء
pos	الشيء الوحيد وصلوا لعالمية المسيار ترى كانوا يشجعون مدريد النصر
pos	حبيبي دي أقل حاجا عندي ياكبير البلد
pos	اوسكار دروفايل اوسكار ماجيستك اوسكار ترافارتينا ايفونك دهانات اوسكار
pos	دكتور اني شفت الحلم بس جان تاريخه ابعد شوية توارد احلام
pos	فيديو مغادرة فريق الاتحاد الرياض لمواجهة فريق النصر بالدوري ويتقدم مروان كوستا
pos	العبي بابجي تبين افوزج
pos	شيكاغو ماتابعته أعرفها لوسيفر
pos	اله يسعدك
pos	أهم أسباب الفوز الهلال نجح التصدي لأكثر فرصة محقه المعيوف يقدم بأفضل آداء الفرصة
pos	٭ ارزقنا دهشة يا اله تغرق ثنايا الروح فرحا
pos	الهلال الاهلي وزيرتنا أختاري لي حساب يحتفلون معنا ذاليلة بمناسبة فوز الهلال يستاهلون
pos	سنه أمسي عليكم يرد أستسلم الخير لتماسيح
pos	تناموا أخبروا اله أوجاعكم أنثروا قلوبكم إليه الوتر جنة القلوب
pos	أناس يتغيرون أقنعة تسقط
pos	عبدالفتاح الإخونج الحال
pos	مباراة العربية غوميز استفز وتلفظ المدافع الشاب عبدالباسط هندي حينها جهلة المدرج الإعلام الجاهل ضحكوا وتن
pos	الهم أغفر وأرحمه عافه وأعفو واكرم نزله وسع مدخله وأغسله بالماء والثلج والبرد ونقه
pos	جاهزين لمباراه يا اغلى جمهور نمورنا قدها باذن اله ربي يفرح قلبي وقلب اتحادي واتحاديه الاتحاد النصر
pos	شتم رجل خالد الوليد إلتفت إليه صحيفتك إملأها بما شئت
pos	أعتقد بأنه المبكر نقرع طبول الإحتفال زالنا بداية الطريق قامت الثورة باستئصال رأس العنكبوت وما
pos	شكرا لتفاعلك وتميزك اناقه تميز روعه إبداع تألق ذوق
pos	كنت احسب انك جروح الزمن طبي تقصف الروح فيني مكفيني
pos	خبر يحق الفيديو الموسيقي مشاهدة اليوتيوب ساعة دقيقة تقريبا
pos	الجميل التحر مشاركة الزوجين أفكار بعضهما بلا خجل خوف التفسيرات الخاطئه لأنهم الثقه الكبيره بينهم
pos	وظيفتك حلم عاطل بيتك المتواضع حلم مشرد طعامك المتكر حلم جائع طفلك المشاغب حلم عقيم صحتك حلم
pos	إشراقة صباحية دعوات تجمع لك الخير كله الهم إني أسألك الهدى والتقى والعفاف والغنى والفوز بالجنة والنجاة
pos	تشرفنا شويات بضيفج
pos	الهم اني اسالك بكل اسم لك ترحم جدتي وتغفرلها الهم فسح قبرها واجعله روضه رياض الجنه تجعله حف
pos	الورد الورد
pos	الحمد مبروك يازعماء القادم أجمل شاء اله
pos	ليضاء قلبك صل محمد وال محمد ألہم صڵ ؏لئ وآل
pos	الاتحاد النصر لاتحسبونا نسينا يالطواقي ولانبيكم توقفون معنا ماحنا بحاجت جماهير مسيار الايام شجعت الكوري
pos	يسلمو روحي
pos	اشراقة الصباح إبن قيم الجوزية مجالسة الصالحين تحولك الشك اليقين الرياء الإخ
pos	
pos	انا مش اقل ساعة
pos	الحب والتقدير لك شاء ہ تكتمل الفرحه
pos	قوتنا اله دائما مبروك الحمد الشكر
pos	سلطان القلوب خوفكان خورفكان خورفكان ونحن نقول تفداك خورفكان تفداك خورفكان
pos	بمناسبة فوز الهلال سحب آيفون رتويت وتابع السحب ساعة موثق بالفديو
pos	الهم امين صبحك اله بالخير والسعادة
pos	ده عشان انت اصيل بس غيرك متن زفت
pos	اكملوا خل كبروا راسك وقت اله اله يفيدونك الخير
pos	مرة أحسك بدايتي الحلوة رغم إنا تجاوزنا البداية
pos	مباراة اياب ربع نهائي دوري ابطال افريقيا الأهلي صن داونز السبت إبريل الساعة مس
pos	ذوق مهاوي
pos	كانوا يضحكون عبدالباسط ويركبون لقطتة جوميز المنزه الفكاهيات ويضحكون جمهورهم الميسر والآن كثر عويله
pos	الحمد مباراه صعبه بتوفيق اله دعمكم تجاوزنا المباراه
pos	وضعنا انا وأمي وأخواتي
pos	يعرف لكم هالذيابه اله يحوجنا لأحد
pos	أختاه كوني تريدك الزهراء فلا شيء يرفع قدرك كالعفة رضا مولاتك عنك فا
pos	مغرد بالصلاه النبي الهم صل وسلم صاحب الوجه الأنور والجبين الأزهر والشفيع المشفع المحشر صل اله وسلم
pos	أغار أحب غيرتي تصل لبكاء أحب الإنتظار أفقد أعصابي بسرعه وأكره فكرة إنشغال أحب
pos	الراجل محق ارقام قياسية شديدة
pos	امين يارب العالمين الخير
pos	صبح بالخير تحفاني يازين الصبح بدا بك
pos	الهم أجعلنا أهل النفوس الطاهرة الشاكرة والوجوه المستبشرة وأرزقنا طيب المقام وحسن الختام
pos	السحب اليلة الايفون رتويت لمرفقة وطبق الشروط
pos	السادسة صباحا إلا
pos	الهلال الاهلي كلما يكاد يسقط الهلال يأبى عبداله إلا ينهظ شكرا تصدياتگ لعله يوفي
pos	الهلال المهمة الأولى جدة فيديو الهلال
pos	البدايه حزنت الاخر انصدمت
pos	اخواتنا ماشوفوش اخوات الناس
pos	أب قبله كالجنه رحل ليخبرني الطيبون يدومون طويلا الهم أغفر وارحمه وأدخله جنات النعيم
pos	اكيد عشان ماتنصدم
pos	يقولون گن جميل المظهر تهوآگ العيون ونحن نقول گن جميل الخلق
